214,Reimburse,to pay back to someone,to make restoration or payment of an equivalent to,to pay back (a sum lost or expended) to someone,to make restoration or payment of an equivalent to,Oops! So Empty!,"refund, repay","refund, repay","pay, compensate, remunerate, satisfy, reimburse, indemnify, repay, recompense mean to give money or its equivalent in return for something

pay implies the discharge of an obligation incurred
paid their bills

compensate implies a making up for services rendered
an attorney well compensated for her services

remunerate clearly suggests paying for services rendered and may extend to payment that is generous or not contracted for
promised to remunerate the searchers handsomely

satisfy implies paying a person what is required by law
all creditors will be satisfied in full

reimburse implies a return of money that has been spent for another's benefit
reimbursed employees for expenses

indemnify implies making good a loss suffered through accident, disaster, warfare
indemnified the families of the dead miners

repay stresses paying back an equivalent in kind or amount
repay a favor with a favor

recompense suggests due return in amends, friendly repayment, or reward
passengers were recompensed for the delay",third,"pay, compensate, remunerate, satisfy, reimburse, indemnify, repay, recompense mean to give money or its equivalent in return for something<br><br>pay implies the discharge of an obligation incurred<br>paid their bills<br><br>compensate implies a making up for services rendered<br>an attorney well compensated for her services<br><br>remunerate clearly suggests paying for services rendered and may extend to payment that is generous or not contracted for<br>promised to remunerate the searchers handsomely<br><br>satisfy implies paying a person what is required by law<br>all creditors will be satisfied in full<br><br>reimburse implies a return of money that has been spent for another's benefit<br>reimbursed employees for expenses<br><br>indemnify implies making good a loss suffered through accident, disaster, warfare<br>indemnified the families of the dead miners<br><br>repay stresses paying back an equivalent in kind or amount<br>repay a favor with a favor<br><br>recompense suggests due return in amends, friendly repayment, or reward<br>passengers were recompensed for the delay"
215,Reprisals,the act or practice in international law of resorting to force short of war in retaliation for damage or loss suffered,something (such as a sum of money) given or paid in restitution,the regaining of something (as by recapture),a retaliatory act,prize,"compensation, damages, indemnification, indemnity, quittance, recompense, recoupment, redress, remuneration, reparation, requital, restitution, satisfaction","compensation, damages, indemnification, indemnity, quittance, recompense, recoupment, redress, remuneration, reparation, requital, restitution, satisfaction",Oops! So Empty!,third,Oops! So Empty!
216,Repugnant,exciting distaste or aversion,"incompatible, inconsistent",hostile,Oops! So Empty!,Oops! So Empty!,"abhorrent, abominable, appalling, awful, disgusting, distasteful, dreadful, evil, foul, fulsome, gross, hideous, horrendous, horrible, horrid, loathsome, nasty, nauseating, nauseous, noisome, noxious, obnoxious, obscene, odious, offensive, rancid, repellent 
 (also repellant), repulsive, revolting, scandalous, shocking, sickening, ugly","innocuous, inoffensive",Oops! So Empty!,first,Oops! So Empty!
217,Resentful,full of resentment,caused or marked by resentment,Oops! So Empty!,Oops! So Empty!,Oops! So Empty!,"acrid, acrimonious, bitter, embittered, hard, rancorous, sore",unbitter,Oops! So Empty!,first,Oops! So Empty!
218,Resilient,characterized or marked by resilience,"able to become strong, healthy, or successful again after something bad happens","able to return to an original shape after being pulled, stretched, pressed, bent, etc.",characterized or marked by resilience,Oops! So Empty!,"bouncy, elastic, flexible, rubberlike, rubbery, springy, stretch, stretchable, stretchy, supple, whippy","inelastic, inflexible, nonelastic, rigid, stiff","elastic, resilient, springy, flexible, supple mean able to endure strain without being permanently injured

elastic implies the property of resisting deformation by stretching
an elastic waistband

resilient implies the ability to recover shape quickly when the deforming force or pressure is removed
a resilient innersole

springy stresses both the ease with which something yields to pressure and the quickness of its return to original shape
the cake is done when the top is springy

flexible applies to something which may or may not be resilient or elastic but which can be bent or folded without breaking
flexible plastic tubing

supple applies to something that can be readily bent, twisted, or folded without any sign of injury
supple leather",first,"elastic, resilient, springy, flexible, supple mean able to endure strain without being permanently injured<br><br>elastic implies the property of resisting deformation by stretching<br>an elastic waistband<br><br>resilient implies the ability to recover shape quickly when the deforming force or pressure is removed<br>a resilient innersole<br><br>springy stresses both the ease with which something yields to pressure and the quickness of its return to original shape<br>the cake is done when the top is springy<br><br>flexible applies to something which may or may not be resilient or elastic but which can be bent or folded without breaking<br>flexible plastic tubing<br><br>supple applies to something that can be readily bent, twisted, or folded without any sign of injury<br>supple leather"
219,Respite,a period of temporary delay,an interval of rest or relief,to grant a temporary period of relief to,"put off, delay",a short delay,Oops! So Empty!,Oops! So Empty!,Oops! So Empty!,first,Oops! So Empty!
220,Revelry,noisy partying or merrymaking,a wild and noisy celebration,wild and noisy celebration,Oops! So Empty!,Oops! So Empty!,"conviviality, festivity, gaiety 
 (also gayety), jollification, jollity, merriment, merrymaking, rejoicing, reveling 
 (or revelling), whoopee","conviviality, festivity, gaiety 
 (also gayety), jollification, jollity, merriment, merrymaking, rejoicing, reveling 
 (or revelling), whoopee",Oops! So Empty!,third,Oops! So Empty!
221,Revulsion,a strong pulling or drawing away,a sudden or strong reaction or change,Oops! So Empty!,Oops! So Empty!,Oops! So Empty!,"aversion, disgust, distaste, horror, loathing, nausea, repugnance, repulsion","aversion, disgust, distaste, horror, loathing, nausea, repugnance, repulsion",Oops! So Empty!,first,Oops! So Empty!
222,Riposte,a fencer's quick return thrust following a parry,a retaliatory verbal sally,a retaliatory maneuver or measure,Oops! So Empty!,Oops! So Empty!,"comeback, repartee, retort","comeback, repartee, retort",Oops! So Empty!,first,Oops! So Empty!
223,Robust,"relating to, resembling, or being a specialized group of australopithecines characterized especially by heavy molars and small incisors adapted to a vegetarian diet",having or exhibiting strength or vigorous health,requiring strength or vigor,"rough, rude",full-bodied,"able-bodied, bouncing, fit, hale, healthy, hearty, sound, well, well-conditioned, whole, wholesome","ailing, diseased, ill, sick, unfit, unhealthy, unsound, unwell","healthy, sound, wholesome, robust, hale, well mean enjoying or indicative of good health

healthy implies full strength and vigor as well as freedom from signs of disease
a healthy family

sound emphasizes the absence of disease, weakness, or malfunction
a sound heart

wholesome implies appearance and behavior indicating soundness and balance
a face with a wholesome glow

robust implies the opposite of all that is delicate or sickly
a lively, robust little boy

hale applies particularly to robustness in old age
still hale at the age of eighty

well implies merely freedom from disease or illness
she has never been a well person",third,"healthy, sound, wholesome, robust, hale, well mean enjoying or indicative of good health<br><br>healthy implies full strength and vigor as well as freedom from signs of disease<br>a healthy family<br><br>sound emphasizes the absence of disease, weakness, or malfunction<br>a sound heart<br><br>wholesome implies appearance and behavior indicating soundness and balance<br>a face with a wholesome glow<br><br>robust implies the opposite of all that is delicate or sickly<br>a lively, robust little boy<br><br>hale applies particularly to robustness in old age<br>still hale at the age of eighty<br><br>well implies merely freedom from disease or illness<br>she has never been a well person"
224,Rudimentary,very imperfectly developed or represented only by a vestige,consisting in first principles,of a primitive kind,not fully developed,"elementary, simple","crude, low, primitive, rude","advanced, developed, evolved, high, higher, late",Oops! So Empty!,third,Oops! So Empty!
225,Rudiments,a basic principle or element or a fundamental skill,something unformed or undeveloped,Oops! So Empty!,Oops! So Empty!,Oops! So Empty!,Oops! So Empty!,Oops! So Empty!,Oops! So Empty!,first,Oops! So Empty!
226,Rusticate,to suspend from school or college,to build or face with usually rough-surfaced masonry blocks having beveled or rebated edges producing pronounced joints,to compel to reside in the country,Oops! So Empty!,Oops! So Empty!,Oops! So Empty!,Oops! So Empty!,Oops! So Empty!,first,Oops! So Empty!
227,Sacrilege,a technical and not necessarily intrinsically outrageous violation (such as improper reception of a sacrament) of what is sacred because consecrated to God,"gross irreverence toward a hallowed person, place, or thing",Oops! So Empty!,Oops! So Empty!,Oops! So Empty!,"blasphemy, defilement, desecration, impiety, irreverence, profanation","adoration, glorification, worship",Oops! So Empty!,third,Oops! So Empty!
228,Saucily,served with or having the consistency of sauce,stylish in dress or appearance,impertinently bold and impudent,being rude and disrespectful,"smart, trim","arch, audacious, bold, bold-faced, brash, brassbound, brassy, brazen, brazen-faced, cheeky, cocksure, cocky, fresh, impertinent, impudent, insolent, nervy, sassy, wise","meek, mousy 
 (or mousey), retiring, shy, timid",Oops! So Empty!,third,Oops! So Empty!
229,Scapegoat,a goat upon whose head are symbolically placed the sins of the people after which he is sent into the wilderness in the biblical ceremony for Yom Kippur,one that bears the blame for others,Oops! So Empty!,Oops! So Empty!,Oops! So Empty!,"fall guy, goat, whipping boy","fall guy, goat, whipping boy",Oops! So Empty!,first,Oops! So Empty!
230,Scourged,a cause of wide or great affliction,an instrument of punishment or criticism,to punish severely,"flog, whip",whip,"flogger, lash, switch, whip","destroy, devastate, ravage, ruin",Oops! So Empty!,third,Oops! So Empty!
231,Sedition,incitement of resistance to or insurrection against lawful authority,"the crime of creating a revolt, disturbance, or violence against lawful civil authority with the intent to cause its overthrow or destruction  — compare criminal syndicalism, sabotage",Oops! So Empty!,Oops! So Empty!,Oops! So Empty!,Oops! So Empty!,Oops! So Empty!,Oops! So Empty!,first,Oops! So Empty!
232,Seneschal,an agent or steward in charge of a lord's estate in feudal times,Oops! So Empty!,Oops! So Empty!,Oops! So Empty!,Oops! So Empty!,Oops! So Empty!,Oops! So Empty!,Oops! So Empty!,third,Oops! So Empty!
233,Shrewd,marked by clever discerning awareness and hardheaded acumen,"severe, hard","abusive, shrewish","ominous, dangerous",mischievous,"astute, canny, clear-eyed, clear-sighted, hard-boiled, hardheaded, heady, knowing, savvy, sharp, sharp-witted, smart",unknowing,"shrewd, sagacious, perspicacious, astute mean acute in perception and sound in judgment

shrewd stresses practical, hardheaded cleverness and judgment
a shrewd judge of character

sagacious suggests wisdom, penetration, and farsightedness
sagacious investors got in on the ground floor

perspicacious implies unusual power to see through and understand what is puzzling or hidden
a perspicacious counselor saw through the child's facade

astute suggests shrewdness, perspicacity, and diplomatic skill
an astute player of party politics",first,"shrewd, sagacious, perspicacious, astute mean acute in perception and sound in judgment<br><br>shrewd stresses practical, hardheaded cleverness and judgment<br>a shrewd judge of character<br><br>sagacious suggests wisdom, penetration, and farsightedness<br>sagacious investors got in on the ground floor<br><br>perspicacious implies unusual power to see through and understand what is puzzling or hidden<br>a perspicacious counselor saw through the child's facade<br><br>astute suggests shrewdness, perspicacity, and diplomatic skill<br>an astute player of party politics"
234,Simpering,marked by insipidity or by affected or ingratiating timidity,Oops! So Empty!,Oops! So Empty!,Oops! So Empty!,Oops! So Empty!,Oops! So Empty!,Oops! So Empty!,Oops! So Empty!,third,Oops! So Empty!
235,Slanders,the utterance of false charges or misrepresentations which defame and damage another's reputation,a false and defamatory oral statement about a person  — compare libel,defamation of a person by unprivileged oral communication made to a third party,the tort of oral defamation,Oops! So Empty!,"asperse, blacken, calumniate, defame, libel, malign, smear, traduce, vilify","aspersing, blackening, calumniation, calumny, character assassination, defamation, defaming, libel, libeling 
 (or libelling), maligning, smearing, traducing, vilification, vilifying","malign, traduce, asperse, vilify, calumniate, defame, slander mean to injure by speaking ill of

malign suggests specific and often subtle misrepresentation but may not always imply deliberate lying
the most maligned monarch in British history

traduce stresses the resulting ignominy and distress to the victim
so traduced the governor that he was driven from office

asperse implies continued attack on a reputation often by indirect or insinuated detraction
both candidates aspersed the other's motives

vilify implies attempting to destroy a reputation by open and direct abuse
no criminal was more vilified in the press

calumniate imputes malice to the speaker and falsity to the assertions
falsely calumniated as a traitor

defame stresses the actual loss of or injury to one's good name
sued them for defaming her reputation

slander stresses the suffering of the victim
town gossips slandered their good name",first,"malign, traduce, asperse, vilify, calumniate, defame, slander mean to injure by speaking ill of<br><br>malign suggests specific and often subtle misrepresentation but may not always imply deliberate lying<br>the most maligned monarch in British history<br><br>traduce stresses the resulting ignominy and distress to the victim<br>so traduced the governor that he was driven from office<br><br>asperse implies continued attack on a reputation often by indirect or insinuated detraction<br>both candidates aspersed the other's motives<br><br>vilify implies attempting to destroy a reputation by open and direct abuse<br>no criminal was more vilified in the press<br><br>calumniate imputes malice to the speaker and falsity to the assertions<br>falsely calumniated as a traitor<br><br>defame stresses the actual loss of or injury to one's good name<br>sued them for defaming her reputation<br><br>slander stresses the suffering of the victim<br>town gossips slandered their good name"
236,Slime,soft moist earth or clay,"a viscous, glutinous, or gelatinous substance",a morally repulsive or odious person,to smear or cover with slime,"to remove slime from (something, such as fish for canning)","guck 
 (or gook), mire, muck, mud, ooze, slop, sludge, slush","guck 
 (or gook), mire, muck, mud, ooze, slop, sludge, slush",Oops! So Empty!,third,Oops! So Empty!
237,Sly,clever in concealing one's aims or ends,tending to keep secrets and hide intentions,both clever and tricky,mischievous sense 2,lightly mischievous,"artful, beguiling, cagey 
 (also cagy), crafty, cunning, cute, designing, devious, dodgy 
[chiefly British], foxy, guileful, scheming, shrewd, slick, subtle, tricky, wily","artless, guileless, ingenuous, innocent, undesigning","sly, cunning, crafty, wily, tricky, foxy, artful, slick mean attaining or seeking to attain one's ends by guileful or devious means

sly implies furtiveness, lack of candor, and skill in concealing one's aims and methods
a sly corporate raider

cunning suggests the inventive use of sometimes limited intelligence in overreaching or circumventing
the cunning fox avoided the trap

crafty implies cleverness and subtlety of method
a crafty lefthander

wily implies skill and deception in maneuvering
the wily fugitive escaped the posse

tricky is more likely to suggest shiftiness and unreliability than skill in deception and maneuvering
a tricky political operative

foxy implies a shrewd and wary craftiness usually involving devious dealing
a foxy publicity man planting stories

artful implies indirectness in dealing and often connotes sophistication or cleverness
elicited the information by artful questioning

slick emphasizes smoothness and guile
slick operators selling time-sharing",first,"sly, cunning, crafty, wily, tricky, foxy, artful, slick mean attaining or seeking to attain one's ends by guileful or devious means<br><br>sly implies furtiveness, lack of candor, and skill in concealing one's aims and methods<br>a sly corporate raider<br><br>cunning suggests the inventive use of sometimes limited intelligence in overreaching or circumventing<br>the cunning fox avoided the trap<br><br>crafty implies cleverness and subtlety of method<br>a crafty lefthander<br><br>wily implies skill and deception in maneuvering<br>the wily fugitive escaped the posse<br><br>tricky is more likely to suggest shiftiness and unreliability than skill in deception and maneuvering<br>a tricky political operative<br><br>foxy implies a shrewd and wary craftiness usually involving devious dealing<br>a foxy publicity man planting stories<br><br>artful implies indirectness in dealing and often connotes sophistication or cleverness<br>elicited the information by artful questioning<br><br>slick emphasizes smoothness and guile<br>slick operators selling time-sharing"
238,Smarm,smarmy language or behavior,Oops! So Empty!,Oops! So Empty!,Oops! So Empty!,Oops! So Empty!,Oops! So Empty!,Oops! So Empty!,Oops! So Empty!,first,Oops! So Empty!
239,Smirk,Oops! So Empty!,Oops! So Empty!,Oops! So Empty!,Oops! So Empty!,Oops! So Empty!,Oops! So Empty!,Oops! So Empty!,Oops! So Empty!,first,Oops! So Empty!
240,Smother,to kill by depriving of air,to suppress expression or knowledge of,to overcome or kill with smoke or fumes,to cook in a covered pan or pot with little liquid over low heat,thick stifling smoke or smudge,"choke, stifle, strangle, suffocate","choke, stifle, strangle, suffocate",Oops! So Empty!,first,Oops! So Empty!
241,Smug,trim or smart in dress,"scrupulously clean, neat, or correct",highly self-satisfied,Oops! So Empty!,Oops! So Empty!,"assured, biggety 
 (or biggity) 
[Southern & Midland], bigheaded, complacent, conceited, consequential, egoistic 
 (also egoistical), egotistic 
 (or egotistical), important, overweening, pompous, prideful, proud, self-conceited, self-important, self-opinionated, self-satisfied, stuck-up, swellheaded, vain, vainglorious","egoless, humble, modest, uncomplacent",Oops! So Empty!,first,Oops! So Empty!
242,Snug,to secure by fastening or lashing down,to cause to fit closely,to make snug,hide sense 1,manifesting seaworthiness,"curl up, nestle, snuggle","disheveled 
 (or dishevelled), disordered, disorderly, messy, mussed, mussy, sloven, slovenly, unkempt, untidy","comfortable, cozy, snug, easy, restful mean enjoying or providing a position of contentment and security

comfortable applies to anything that encourages serenity, well-being, or complacency as well as physical ease
started feeling comfortable in our new surroundings

cozy suggests warmth, shelter, assured ease, and friendliness
a cozy neighborhood coffee shop

snug suggests having just enough space for comfort and safety but no more
a snug little cottage

easy implies relief from or absence of anything likely to cause discomfort or constraint
living in easy circumstances

restful applies to whatever induces or contributes to rest or relaxation
a quiet restful vacation",third,"comfortable, cozy, snug, easy, restful mean enjoying or providing a position of contentment and security<br><br>comfortable applies to anything that encourages serenity, well-being, or complacency as well as physical ease<br>started feeling comfortable in our new surroundings<br><br>cozy suggests warmth, shelter, assured ease, and friendliness<br>a cozy neighborhood coffee shop<br><br>snug suggests having just enough space for comfort and safety but no more<br>a snug little cottage<br><br>easy implies relief from or absence of anything likely to cause discomfort or constraint<br>living in easy circumstances<br><br>restful applies to whatever induces or contributes to rest or relaxation<br>a quiet restful vacation"
243,Sober,marked by sedate or gravely or earnestly thoughtful character or demeanor,"marked by temperance, moderation, or seriousness",subdued in tone or color,not intoxicated,"unhurried, calm","clearheaded, straight","blasted 
[slang], blind, blitzed 
[slang], blotto 
[slang], bombed, boozy, canned 
[slang], cockeyed, crocked, drunk, drunken, fried, gassed, hammered 
[slang], high, inebriate, inebriated, intoxicated, juiced 
[slang], lit, lit up, loaded 
[slang], looped, oiled 
[slang], pickled, pie-eyed, plastered, potted 
[slang], ripped 
[slang], sloshed 
[slang], smashed 
[slang], sottish, soused, sozzled, squiffed 
 (or squiffy), stewed, stiff, stinking 
[slang], stoned, tanked 
[slang], tight, tipsy, wasted 
[slang], wiped out 
[slang]","serious, grave, solemn, sedate, staid, sober, earnest mean not light or frivolous

serious implies a concern for what really matters
a serious play about social injustice

grave implies both seriousness and dignity in expression or attitude
read the proclamation in a grave voice

solemn suggests an impressive gravity utterly free from levity
a sad and solemn occasion

sedate implies a composed and decorous seriousness
remained sedate amid the commotion

staid suggests a settled, accustomed sedateness and prim self-restraint
a quiet and staid community

sober stresses seriousness of purpose and absence of levity or frivolity
a sober look at the state of our schools

earnest suggests sincerity or often zealousness of purpose
an earnest reformer",first,"serious, grave, solemn, sedate, staid, sober, earnest mean not light or frivolous<br><br>serious implies a concern for what really matters<br>a serious play about social injustice<br><br>grave implies both seriousness and dignity in expression or attitude<br>read the proclamation in a grave voice<br><br>solemn suggests an impressive gravity utterly free from levity<br>a sad and solemn occasion<br><br>sedate implies a composed and decorous seriousness<br>remained sedate amid the commotion<br><br>staid suggests a settled, accustomed sedateness and prim self-restraint<br>a quiet and staid community<br><br>sober stresses seriousness of purpose and absence of levity or frivolity<br>a sober look at the state of our schools<br><br>earnest suggests sincerity or often zealousness of purpose<br>an earnest reformer"
244,Sojourn,a temporary stay,to stay as a temporary resident,a temporary stay,to stay as a temporary resident,Oops! So Empty!,"stay, tarry, visit","crash 
[slang], stay, tarry, visit",Oops! So Empty!,first,Oops! So Empty!
245,Sporadic,"occurring occasionally, singly, or in scattered instances",arising or occurring randomly with no known cause,Oops! So Empty!,Oops! So Empty!,Oops! So Empty!,"aperiodic, casual, catchy, choppy, discontinuous, episodic 
 (also episodical), erratic, fitful, intermittent, irregular, occasional, spasmodic, spastic, spotty, unsteady","constant, continuous, habitual, periodic, regular, repeated, steady","infrequent, uncommon, scarce, rare, sporadic mean not common or abundant

infrequent implies occurrence at wide intervals in space or time
infrequent family visits

uncommon suggests a frequency below normal expectation
smallpox is now uncommon in many countries

scarce implies falling short of a standard or required abundance
jobs were scarce during the Depression

rare suggests extreme scarcity or infrequency and often implies consequent high value
rare first editions

sporadic implies occurrence in scattered instances or isolated outbursts
sporadic cases of influenza",first,"infrequent, uncommon, scarce, rare, sporadic mean not common or abundant<br><br>infrequent implies occurrence at wide intervals in space or time<br>infrequent family visits<br><br>uncommon suggests a frequency below normal expectation<br>smallpox is now uncommon in many countries<br><br>scarce implies falling short of a standard or required abundance<br>jobs were scarce during the Depression<br><br>rare suggests extreme scarcity or infrequency and often implies consequent high value<br>rare first editions<br><br>sporadic implies occurrence in scattered instances or isolated outbursts<br>sporadic cases of influenza"
